commit	avg_score	status	description
b8d4cf7	65	baseline	—
bf1afa2	72	keep	修复事实错误和排版问题（门槛/Canva/书名号/分形表述）
bf69eec	78	keep	去掉冗余排比和鸡汤结尾收紧地图比喻段
c46baa2	84	keep	精简知识星球段落去掉修饰语堆叠并补上分形关联
84aded9	86	keep	收紧开头和过渡段去掉重复的好像和模糊词
fe3d850	89	keep	去掉套话精简Perplexity段和产品讨论段冗长表述
5426ce1	90	keep	精简产品讨论段长句去掉括号堆叠的公司名
928d35b	94	keep	加强想法空间与分形关联去掉括号解释消除重复感
a43ac7c	95	keep	收紧L15长问句和知识星球引入段去掉冗余铺垫
5dc0e13	96	keep	消除Fivetran段重复表达收紧第三个问题的冗长句
b436f53	96	revert	去掉教科书式过渡和模板化应答收紧Perplexity引入
de4fc5d	71	baseline	creativity.md baseline
680d40b	75	keep	修正标点病句和人名译名等编辑规范问题
663fbd9	78	keep	去掉打破习惯段重复的敏感表述和游离的PG引用
01e3262	82	keep	收紧结尾去掉重复引用和AI式排比总结
0563b4c	84	keep	去掉打破习惯和注意到问题段的说教句
82a9f2a	85	keep	删掉观察力训练的教科书式拆解保留类比结论
0a695cb	87	keep	精简连接与涌现段的过渡句减少重复解释
6af77e4	88	keep	合并注意到问题段开头两段重复表述为一段
5b1413b	88	revert	去掉模仿段中重复的过渡句和多余修饰
9be7f1c	89	keep	微调标点让断句更自然
8353616	90	keep	合并连续引用段去掉与开头重复的乔布斯引用
